{"schema_version":"iris-v1-vector-schema-1","id":"IRIS-V1-RUNTIME-V090","name":"Nested Module MRO","category":"positive","source":{"chapter":"RUNTIME","artifact":"spec/iris-v1/03-runtime-object-model.md","clauses":["IRIS-V1-RUNTIME-C160"],"decisions":["D-319","D-320"]},"input":{"kind":"source","source_text":"class C mixin A,B; B mixin A; each defines trace"},"applicability":{"interpreter":"required","jit":"required","native":"not_applicable","reason":"Controlled Module/Class fixture has no native boundary."},"expect":{"value":":B; closed A appears once in MRO."},"tags":["bucket:executable"]}
