{"schema_version":"iris-v1-vector-schema-1","id":"IRIS-V1-TYPES-V261","name":"Contract conformance is a Class fact, not a Module one","category":"diagnostic","source":{"chapter":"TYPES","artifact":"spec/iris-v1/05-types-contracts-generics.md","clauses":["IRIS-V1-TYPES-C044"],"decisions":["D-279"]},"input":{"kind":"source","source_text":"contract C { fun m() -> Nil } module M for C {} class A { public fun m() -> Nil { nil } } impl A for C { }"},"applicability":{"interpreter":"required","jit":"required","native":"not_applicable","reason":"A declaration header has no native boundary."},"expect":{"diagnostics":[{"code":"CONTRACT_FOR_CLASS_ONLY"}]},"tags":["bucket:executable"]}
