{"schema_version":"iris-v1-vector-schema-1","id":"IRIS-V1-RUNTIME-V980","name":"Numeric public hashes follow canonical finite and infinity encodings","category":"positive","source":{"chapter":"RUNTIME","artifact":"spec/iris-v1/03-runtime-object-model.md","clauses":["IRIS-V1-RUNTIME-C137","IRIS-V1-RUNTIME-C138","IRIS-V1-RUNTIME-C139","IRIS-V1-RUNTIME-C140","IRIS-V1-RUNTIME-C141","IRIS-V1-RUNTIME-C142","IRIS-V1-RUNTIME-C143"],"decisions":[]},"input":{"kind":"fixture","independent_sources":["%[Integer(0).hash(), Integer(1).hash(), Integer(-1).hash(), Integer(2).hash()]","%[Float64.infinity.hash(), (-Float64.infinity).hash()]"]},"applicability":{"interpreter":"required","jit":"required","native":"not_applicable","reason":"Observable from source with no native boundary."},"expect":{"independent_expectations":[{"value":{"array":[{"integer":"4379003086384345280"},{"integer":"17824117788395916856"},{"integer":"4134578751433783052"},{"integer":"14159628755083520277"}]}},{"value":{"array":[{"integer":"13642208101069356640"},{"integer":"6949751103572778473"}]}}]},"tags":["bucket:executable"]}
