{"schema_version": "iris-v1-vector-schema-1", "id": "IRIS-V1-META-V914", "name": "Direct import source order determines compatible extension replacement", "category": "differential", "source": {"chapter": "META", "artifact": "spec/iris-v1/08-modules-metaprogramming.md", "clauses": ["IRIS-V1-META-C019"], "decisions": []}, "input": {"kind": "fixture", "fixture_ref": "Compile two consumers with the same compatible extension imports in opposite source orders while varying filesystem and hash iteration order."}, "applicability": {"interpreter": "required", "jit": "required", "native": "not_applicable", "reason": "Requires import-order-dependent implementation selection across packages. Package sources cannot declare a `module`, answering UnsupportedConstruct."}, "expect": {"status": "Each consumer selects the implementation from its later direct import regardless of filesystem, scheduler, name sort or map order."}, "tags": ["bucket:needs-subsystem"]}