{"schema_version":"iris-v1-vector-schema-1","id":"IRIS-V1-FFI-V068","name":"Script access to the Host ABI is rejected statically","category":"diagnostic","source":{"chapter":"FFI","artifact":"spec/iris-v1/09-native-host-ffi.md","clauses":["IRIS-V1-FFI-C004","IRIS-V1-FFI-C005"],"decisions":["D-033"]},"input":{"kind":"source","source_text":"module M { public fun run() -> Object { HostABI.load(\"fixtures/ffi/libfixture\") } } M.run()"},"applicability":{"interpreter":"required","jit":"required","native":"not_applicable","reason":"The row observes a refusal that happens BEFORE any native call."},"expect":{"diagnostics":[{"code":"ffi.host-abi-script-access"}]},"tags":["bucket:executable"]}
