{"schema_version":"iris-v1-vector-schema-1","id":"IRIS-V1-RUNTIME-V080","name":"Overload declaration rejection","category":"negative","source":{"chapter":"RUNTIME","artifact":"spec/iris-v1/03-runtime-object-model.md","clauses":["IRIS-V1-RUNTIME-C160"],"decisions":["D-235","D-358"]},"input":{"kind":"source","source_text":"class A { fun f(value: Integer) -> Symbol { :integer }; fun f(value: String) -> Symbol { :string } }"},"applicability":{"interpreter":"required","jit":"not_applicable","native":"not_applicable","reason":"Declaration validation precedes executable or native dispatch."},"expect":{"error":{"code":"RuntimeError","phase":"runtime"},"side_effects":"A is not published."},"tags":["bucket:executable"]}
