{"schema_version":"iris-v1-vector-schema-1","id":"IRIS-V1-RUNTIME-V922","name":"Cross-instance raw ivar access is rejected at parse","category":"diagnostic","source":{"chapter":"RUNTIME","artifact":"spec/iris-v1/03-runtime-object-model.md","clauses":["IRIS-V1-RUNTIME-C067"],"decisions":[]},"input":{"kind":"source","source_text":"class A { public fun f(o) { o.@x } }"},"applicability":{"interpreter":"required","jit":"required","native":"not_applicable","reason":"Observable from source with no native boundary."},"expect":{"diagnostics":[{"code":"PARSE_UNEXPECTED_TOKEN"}]},"tags":["bucket:executable","phase:parse"]}
