{"schema_version": "iris-v1-vector-schema-1", "id": "IRIS-V1-CONTROL-V283", "name": "A cleanup failure with no pending exception becomes the primary context", "category": "positive", "source": {"chapter": "CONTROL", "artifact": "spec/iris-v1/04-bindings-callables-control-flow.md", "clauses": [], "decisions": []}, "input": {"kind": "source", "source_text": "mut n = 0; class It { public fun next() { n = n + 1; if n < 2 { Iteration.yield(1) } else { Iteration.done } } public fun close() { raise :close } } class S { public fun iterator() { It.new() } } try { for x in S.new() { nil } } catch _, c { %[c.value, c.suppressed] }"}, "applicability": {"interpreter": "required", "jit": "required", "native": "not_applicable", "reason": "Pure Iris source has no native boundary."}, "expect": {"value": {"array": [{"symbol": "close"}, {"array": []}]}}, "tags": ["bucket:executable"]}