{"schema_version":"iris-v1-vector-schema-1","id":"IRIS-V1-META-V030A","name":"A Class has exactly one origin declaration","category":"diagnostic","source":{"chapter":"META","artifact":"spec/iris-v1/08-modules-metaprogramming.md","clauses":["IRIS-V1-META-C030"],"decisions":[]},"input":{"kind":"source","source_text":"class A { } class A { }"},"applicability":{"interpreter":"required","jit":"required","native":"not_applicable","reason":"Observable from source with no native boundary."},"expect":{"diagnostics":[{"code":"QUALIFIED_NAMESPACE_COLLISION"}]},"tags":["bucket:executable","phase:parse"]}
