{"schema_version":"iris-v1-vector-schema-1","id":"IRIS-V1-COLLECTIONS-V001","name":"The specification-stable Symbol hash of :name","category":"positive","source":{"chapter":"COLLECTIONS","artifact":"spec/iris-v1/06-collections-text-regex.md","clauses":["IRIS-V1-COLLECTIONS-C003","IRIS-V1-COLLECTIONS-C086","IRIS-V1-COLLECTIONS-C087"],"decisions":["D-033"]},"input":{"kind":"source","source_text":"class Z { } :name.hash()"},"applicability":{"interpreter":"required","jit":"required","native":"not_applicable","reason":"Pure Iris source has no native boundary."},"expect":{"value":{"integer":"10999003376002830561"}},"tags":["bucket:executable"]}
