{"schema_version": "iris-v1-vector-schema-1", "id": "IRIS-V1-LIBRARY-V905", "name": "Nominal deserialization validates before publication", "category": "negative", "source": {"chapter": "LIBRARY", "artifact": "spec/iris-v1/10-serialization-standard-library.md", "clauses": ["IRIS-V1-LIBRARY-C006"], "decisions": []}, "input": {"kind": "source", "source_text": "contract Serializable { fun serialize() -> Object } class User { public class fun deserialize(representation) -> Object { :rebuilt } } impl User for Serializable { public fun serialize() -> Object { 1 } } module M { public fun run() -> Object { mut s = %{}; s[\"magic\"] = \"IRISVALUE\"; s[\"format_version\"] = 1; s[\"nominal\"] = :User; s[\"schema_version\"] = 2; s[\"payload\"] = 7;  IrisValue.decode(s) } } M.run()"}, "applicability": {"interpreter": "required", "jit": "required", "native": "not_applicable", "reason": "Supported. C006 validates the declared schema version and Serializable conformance BEFORE publishing, so a nominal stream declaring schema 2 against the Class's version 1 is refused and no partially initialized User is published. The nominal path now routes through `decode_nominal`, which the earlier reason correctly identified as absent."}, "expect": {"error": {"code": "IRISVALUE_INCOMPATIBLE_HEADER", "phase": "runtime"}}, "tags": ["bucket:executable"]}
