{"schema_version":"iris-v1-vector-schema-1","id":"IRIS-V1-CONTROL-V341","name":"A Closure reaches a Method through the dedicated block channel","category":"negative","source":{"chapter":"CONTROL","artifact":"spec/iris-v1/04-bindings-callables-control-flow.md","clauses":[],"decisions":[]},"input":{"kind":"source","source_text":"class C { public fun m(&b) { b.call() } } C.new().m({ 3 })"},"applicability":{"interpreter":"required","jit":"required","native":"not_applicable","reason":"Pure Iris source has no native boundary."},"expect":{"value":{"integer":"3"}},"tags":["bucket:executable"]}
