{"schema_version":"iris-v1-vector-schema-1","id":"IRIS-V1-CONTROL-V289","name":"A typed catch executes before finally","category":"positive","source":{"chapter":"CONTROL","artifact":"spec/iris-v1/04-bindings-callables-control-flow.md","clauses":[],"decisions":[]},"input":{"kind":"source","source_text":"mut log = %[]; let r = try { raise :x } catch error: Symbol { log.append(:catch); error } finally { log.append(:finally) }; %[r, log]"},"applicability":{"interpreter":"required","jit":"required","native":"not_applicable","reason":"Pure Iris source has no native boundary."},"expect":{"value":{"array":[{"symbol":"x"},{"array":[{"symbol":"catch"},{"symbol":"finally"}]}]}},"tags":["bucket:executable"]}
