{"schema_version":"iris-v1-vector-schema-1","id":"IRIS-V1-TYPES-V239","name":"A Module whose initializer raises publishes neither shared property","category":"diagnostic","source":{"chapter":"TYPES","artifact":"spec/iris-v1/05-types-contracts-generics.md","clauses":["IRIS-V1-TYPES-C045","IRIS-V1-META-C022"],"decisions":["D-212"]},"input":{"kind":"source","source_text":"module M { shared class property first: Integer = 1 raise :stop shared class property second: Integer = 2 } M"},"applicability":{"interpreter":"required","jit":"required","native":"not_applicable","reason":"Pure Iris source has no native boundary."},"expect":{"error":{"code":"stop","phase":"runtime"},"side_effects":"M is not published."},"tags":["bucket:executable"]}
