{"schema_version":"iris-v1-vector-schema-1","id":"IRIS-V1-LIBRARY-V912","name":"Malformed standard decoder input fails safely","category":"positive","source":{"chapter":"LIBRARY","artifact":"spec/iris-v1/10-serialization-standard-library.md","clauses":["IRIS-V1-LIBRARY-C035"],"decisions":[]},"input":{"kind":"source","source_text":"module M { public fun run() -> Object { let bad = try { JSON.decode(\"{oops\") } catch e { :refused }; let good = JSON.decode(\"{\\\"a\\\":1}\"); %[bad, good.length()] } } M.run()"},"applicability":{"interpreter":"required","jit":"required","native":"not_applicable","reason":"Malformed decoder input has no native boundary."},"expect":{"value":{"array":[{"symbol":"refused"},{"integer":"1"}]}},"tags":["bucket:executable"]}
