{"schema_version":"iris-v1-vector-schema-1","id":"IRIS-V1-META-V938","name":"Every concrete META vector ID remains machine-readable with its outcome","category":"diagnostic","source":{"chapter":"META","artifact":"spec/iris-v1/08-modules-metaprogramming.md","clauses":["IRIS-V1-META-C113"],"decisions":[]},"input":{"kind":"fixture","fixture_ref":"Audit every concrete META vector row against the committed machine-readable corpus by stable ID and observable outcome."},"applicability":{"interpreter":"not_applicable","jit":"not_applicable","native":"not_applicable","reason":"This is a conformance-corpus documentation audit rather than language execution."},"expect":{"status":"Every concrete META vector ID is preserved or mapped to one machine-readable record with the same observable outcome; no summary-only row counts as its replacement."},"tags":["bucket:documentation"]}
