{"schema_version":"iris-v1-vector-schema-1","id":"IRIS-V1-TYPES-V201","name":"A candidate cannot drop a declared ancestor carrying a static spine fact","category":"diagnostic","source":{"chapter":"TYPES","artifact":"spec/iris-v1/05-types-contracts-generics.md","clauses":["IRIS-V1-TYPES-C045","IRIS-V1-TYPES-C098","IRIS-V1-META-C120"],"decisions":["D-174"]},"input":{"kind":"source","source_text":"contract Walks { fun walk() } class Animal { public fun walk() -> Nil { nil } } impl Animal for Walks { } class Dog extends Animal { } let refused = try { Reflection::Class.set_superclass(Dog, Object) } catch e { e }; %[refused, Dog.type.subtype?(Animal.type)]"},"applicability":{"interpreter":"required","jit":"required","native":"not_applicable","reason":"Pure Iris source has no native boundary."},"expect":{"value":{"array":[{"symbol":"TypeContractError"},{"bool":true}]}},"tags":["bucket:executable"]}
