{"schema_version":"iris-v1-vector-schema-1","id":"IRIS-V1-RUNTIME-V074","name":"Canonical bytes unavailable","category":"negative","source":{"chapter":"RUNTIME","artifact":"spec/iris-v1/03-runtime-object-model.md","clauses":["IRIS-V1-RUNTIME-C160"],"decisions":["D-087"]},"input":{"kind":"source","source_text":"Integer(1).canonical_numeric_bytes()"},"applicability":{"interpreter":"required","jit":"required","native":"not_applicable","reason":"Pure Iris source has no native boundary."},"expect":{"error":{"code":"MessageNotFoundError"}},"tags":["bucket:executable"]}
