{"schema_version":"iris-v1-vector-schema-1","id":"IRIS-V1-META-V935","name":"ReflectionAccessError reports denial context without leaking inaccessible data","category":"diagnostic","source":{"chapter":"META","artifact":"spec/iris-v1/08-modules-metaprogramming.md","clauses":["IRIS-V1-META-C108"],"decisions":[]},"input":{"kind":"fixture","fixture_ref":"Deny inspect and mutate operations across package and target scopes, catch ReflectionAccessError in Iris, and inspect its public fields and Host channel behavior."},"applicability":{"interpreter":"required","jit":"required","native":"not_applicable","reason":"Requires Host-configured ReflectionPolicy plus structured error fields."},"expect":{"status":"The ordinary Iris error reports caller package, operation, target scope and denial origin, leaks no inaccessible member data, and uses no Host-only failure channel."},"tags":["bucket:needs-subsystem"]}
