{"schema_version":"iris-v1-vector-schema-1","id":"IRIS-V1-CONTROL-V352","name":"A top-level call is a privileged implicit send to main","category":"positive","source":{"chapter":"CONTROL","artifact":"spec/iris-v1/04-bindings-callables-control-flow.md","clauses":["IRIS-V1-CONTROL-C012"],"decisions":[]},"input":{"kind":"source","source_text":"mut log = 0; module M { fun helper() -> Integer { log = 1; 1 } helper() } log"},"applicability":{"interpreter":"required","jit":"required","native":"not_applicable","reason":"Pure Iris source has no native boundary."},"expect":{"value":{"integer":"1"}},"tags":["bucket:executable"]}
