{"schema_version":"iris-v1-vector-schema-1","id":"IRIS-V1-TYPES-V214","name":"An intersection reflects the union member, not distributed alternatives","category":"positive","source":{"chapter":"TYPES","artifact":"spec/iris-v1/05-types-contracts-generics.md","clauses":["IRIS-V1-TYPES-C016"],"decisions":["D-187"]},"input":{"kind":"source","source_text":"class A {} class B {} class C {} let t = (A & (B | C)).type; %[t.kind, (B | C).type same? t.members[1]]"},"applicability":{"interpreter":"required","jit":"required","native":"not_applicable","reason":"Pure Iris source has no native boundary."},"expect":{"value":{"array":[{"symbol":"intersection"},{"bool":true}]}},"tags":["bucket:executable"]}
