{"schema_version":"iris-v1-vector-schema-1","id":"IRIS-V1-CONTROL-V906","name":"A body with no value-producing statement returns nil","category":"positive","source":{"chapter":"CONTROL","artifact":"spec/iris-v1/04-bindings-callables-control-flow.md","clauses":["IRIS-V1-CONTROL-C019"],"decisions":[]},"input":{"kind":"source","source_text":"class A { public fun f() { } }; A.new().f()"},"applicability":{"interpreter":"required","jit":"required","native":"not_applicable","reason":"Observable from source with no native boundary."},"expect":{"value":{"nil":true}},"tags":["bucket:executable"]}
