{"schema_version":"iris-v1-vector-schema-1","id":"IRIS-V1-TYPES-V231","name":"A placeholder is inferred at construction but forbidden in an annotation","category":"diagnostic","source":{"chapter":"TYPES","artifact":"spec/iris-v1/05-types-contracts-generics.md","clauses":["IRIS-V1-TYPES-C059"],"decisions":["D-204"]},"input":{"kind":"source","source_text":"class Box<T> { fun initialize(value: T) -> Nil {} } let b: Box<String> = Box<_>.new(\"x\"); let bad: Box<_> = b; bad"},"applicability":{"interpreter":"required","jit":"required","native":"not_applicable","reason":"A declaration has no native boundary."},"expect":{"diagnostics":[{"code":"GENERIC_PLACEHOLDER_FORBIDDEN"}]},"tags":["bucket:executable"]}
